{
  "authorityId": "iso-21502-2020",
  "basis": "migrated-verified-profile",
  "kind": "ordivon.external-authority-observation",
  "lifecycleStatus": "published",
  "note": null,
  "observedDate": "2026-09-14",
  "officialSource": "https://www.iso.org/standard/74947.html",
  "schemaVersion": 1,
  "versionObserved": "2020"
}
